{
  "$schema": "../../2026-08-28/production-reference/production-reference.schema.json",
  "schema_version": "1.0.0",
  "asset_id": "GGP.UI.FrontEndVersusPerspective.ReferenceV1",
  "title": "GGP Front-End and Versus Perspective UI System V1",
  "category": "ui-system",
  "status": "technical-review",
  "production_ready": false,
  "implementation_profile": "expanded",
  "owners": ["ui-art", "ui-engineering", "gameplay", "accessibility", "audio", "narrative"],
  "metadata": {"purpose": "Main-menu, front-end state, versus perspective, commander, spectator, respawn, accessibility, render, input, and hidden-truth boundary contract.", "authoritative_sidecar": true, "engine_targets": ["Unreal Engine 5.8 UMG", "Slate", "Material Editor"], "export_targets": ["Widget Blueprints", "UI materials", "Data Assets", "automated UI tests"], "source_preservation": "Original menu, versus, and helmet HUD concepts remain unchanged.", "naming_prefixes": {"widget": "WBP_", "material": "M_UI_", "render_target": "RT_UI_", "animation": "ANI_UI_", "sound": "SND_UI_"}},
  "source_sheet": {"path": "docs/concept-art/2026-08-29/production-reference/ggp-front-end-versus-perspective-ui-system-v1.png", "sha256": "e8871926dfc46db8c0a8fa07c6e890155a53bff2d4bc7523f75275968bb1153d", "width_px": 1536, "height_px": 1024, "role": "design-authority", "generated_on": "2026-08-29", "notes": "Antagonist perspective information is mode-specific and must never leak into the survival helmet HUD."},
  "concept_sources": [
    {"path": "Art/UI/Menu/MainMenu_Backdrop_v1.png", "role": "main-menu world-backed atmosphere and composition", "required": true},
    {"path": "Art/UI/HelmetHUD/T_HelmetVisorFrame_v1.png", "role": "survival visor frame texture", "required": true},
    {"path": "docs/concept-art/reference/versus/antagonist-perspectives-hud-concept-sheet.png", "role": "antagonist, commander, and spectator perspective authority", "required": true},
    {"path": "docs/concept-art/2026-08-29/production-reference/ggp01-modular-helmet-hud-v2.png", "role": "survival HUD visual and Bloom deception authority", "required": true},
    {"path": "docs/PRD.md", "role": "front-end, character creation, versus, commander, lobby, reconnect, and survival requirements", "required": true}
  ],
  "concept_source_sets": [{"root": "Art/UI", "role": "checked-in UI art lineage", "required": true, "lifecycle": "current-reference"}, {"root": "docs/concept-art/reference/versus", "role": "versus perspective concepts", "required": true, "lifecycle": "design-reference"}],
  "authority": {"approved": [{"field": "menu_entries", "value": ["NewGame", "Continue", "Settings", "CharacterCreation", "Versus", "Credits", "Exit"], "source": "PRD and source sheet"}, {"field": "perspectives", "value": ["survival_player", "Bloom_antagonist", "pirate_antagonist", "rebel_antagonist", "alien_antagonist", "commander_tactical", "spectator"], "source": "versus concept and PRD"}, {"field": "Bloom_deception", "value": "genuine and false warnings are identical in every player-facing property", "source": "helmet HUD contract"}, {"field": "hidden_truth_access", "value": "forbidden to normal player UI, materials, animation, audio, accessibility, and shipping debug overlays", "source": "deception contract"}], "provisional": [{"field": "reference_resolution", "value": [2560, 1440], "source": "UI production proposal"}], "conflicts": []},
  "build": {
    "coordinate_system": {"units": "logical-pixels", "forward": "+X", "up": "+Y", "unreal_units_per_meter": 100}, "dimensions_m": null, "pivot": {"screen": "safe-area center", "anchors": "normalized safe-area coordinates"},
    "parts": [{"id": "main_menu"}, {"id": "menu_navigation"}, {"id": "state_feedback"}, {"id": "survival_HUD_boundary"}, {"id": "antagonist_perspectives"}, {"id": "commander_tactical"}, {"id": "spectator_respawn"}, {"id": "accessibility"}],
    "materials": [{"id": "M_UI_Opaque"}, {"id": "M_UI_Translucent"}, {"id": "M_UI_Additive"}, {"id": "M_UI_PostProcess"}],
    "sockets": [{"name": "Anchor_MenuColumn", "normalized": [0.08, 0.5]}, {"name": "Anchor_Title", "normalized": [0.5, 0.08]}, {"name": "Anchor_StateFeedback", "normalized": [0.5, 0.82]}, {"name": "Anchor_Tactical", "normalized": [0.5, 0.5]}, {"name": "Anchor_Spectator", "normalized": [0.5, 0.08]}],
    "states": [{"id": "loading"}, {"id": "enabled"}, {"id": "disabled"}, {"id": "focused"}, {"id": "error"}, {"id": "reconnect"}, {"id": "save_warning"}, {"id": "spectator"}, {"id": "respawn"}],
    "blender": {"root_collection": "GGP_UI_FrontEndPreview", "not_applicable_for_runtime": true},
    "unreal": {"asset_type": "UMG Widget Blueprint, Material, RenderTarget, and DataAsset", "destination_root": "/Game/UI", "roots": {"HUD": "/Game/UI/HUD", "main_menu": "/Game/UI/MainMenu", "versus": "/Game/UI/Versus", "commander": "/Game/UI/Commander", "widgets": "/Game/UI/Widgets", "materials": "/Game/UI/Materials"}},
    "rig": {"not_applicable": true, "reason": "UI uses widget hierarchy, anchors, focus navigation, and animation tracks."},
    "animation": {"states": [{"id": "intro"}, {"id": "idle"}, {"id": "focus"}, {"id": "alert_warning"}, {"id": "pulse_critical"}, {"id": "loading"}, {"id": "outro"}], "requirements": [{"id": "AN-UI-001", "requirement": "Reduced-motion mode replaces nonessential sweeps, pulses, flicker, and parallax with static state changes."}, {"id": "AN-UI-002", "requirement": "Genuine and false Bloom warnings use the same widget and animation tracks."}]},
    "vfx": {"layers": [{"id": "backdrop"}, {"id": "world_frame"}, {"id": "HUD_base"}, {"id": "HUD_overlay"}, {"id": "focus"}, {"id": "debug_nonshipping"}], "requirements": [{"id": "VFX-UI-001", "requirement": "No post-process, material, or color treatment may distinguish false from genuine Bloom."}]},
    "spline_mapping": {"splines": [{"id": "UI_FocusPath"}, {"id": "UI_TacticalRoute"}, {"id": "UI_ObjectiveEdgeClamp"}], "requirements": [{"id": "SP-UI-001", "requirement": "Focus order is deterministic for controller, keyboard, mouse, localization, and assistive modes."}]},
    "render_mapping": {"passes": [{"id": "RT_UI_Player"}, {"id": "RT_UI_BloomPerspective"}, {"id": "RT_UI_RebelPerspective"}, {"id": "RT_UI_AlienPerspective"}, {"id": "RT_UI_TacticalOverlay"}], "channels": [{"name": "Information", "color": "cyan"}, {"name": "Attention", "color": "amber"}, {"name": "Critical", "color": "red"}, {"name": "Anomaly", "color": "violet"}], "DPI": {"reference_resolution": [2560, 1440], "supported_aspects": ["16:9", "16:10", "21:9", "4:3"], "localization_expansion": 1.3}},
    "implementation": {"widget_hierarchy": {"root": "WBP_Root", "children": ["WBP_Backdrop", "WBP_SafeGuide", "WBP_Menu", "WBP_Context", "WBP_Footer"]}, "input_modes": ["controller", "keyboard_mouse"], "accessibility": ["high_contrast", "reduced_motion", "large_text", "captions", "color_independent"], "perspective_isolation": {"survival_player": "limited information, trust nothing", "antagonist": "perspective-specific only", "spectator_commander": "not survival player UI"}, "forbidden_inputs": ["BloomTruth", "IsFalseSignal", "PsychosisTruth", "hidden_antagonist_diagnostics"]}
  },
  "acceptance_checks": [{"id": "UI-FE-001", "status": "pending", "requirement": "All menu states, focus paths, save, reconnect, controller, mouse, keyboard, localization, and aspect-ratio cases pass automated UI tests."}, {"id": "UI-FE-002", "status": "pending", "requirement": "Antagonist diagnostics never reach the survival HUD through data binding, animation, material, audio, accessibility, telemetry, or shipping debug UI."}, {"id": "UI-FE-003", "status": "pending", "requirement": "Genuine and false Bloom warning objects remain structurally and value identical."}, {"id": "UI-FE-004", "status": "pending", "requirement": "Reduced motion, high contrast, captions, color-independent cues, DPI, safe areas, and localization expansion pass accessibility QA."}],
  "build_questions": ["Confirm final front-end navigation model for online sessions, reconnect, and host migration.", "Confirm which antagonist perspectives ship in the first versus milestone without broadening survival-player knowledge."]
}
